1. Display the information in one table (either table is fine).
sqlite> SELECT * FROM teachers;
id          name
----------  --------------------
1           Professor McGonagall
2           Professor Snape
3           Professor Moriarty


2. Update an item that meets some condition (you can choose a condition that makes sense).
sqlite> UPDATE students SET grade=10 WHERE name="Tom Bombadil";
sqlite>


3. Display the information in both tables using one query.
sqlite> SELECT * FROM students JOIN teachers ON students.teacher_id=teachers.id;
id          name         grade       permission_slip  teacher_id  id          name
----------  -----------  ----------  ---------------  ----------  ----------  ---------------
1           Amelia Pond  11          false            2           2           Professor Snape
2           Tom Bombadi  10          true             1           1           Professor McGon
3           Dead Pool    10          false            3           3           Professor Moria
4           Mal Reynold  12          true             2           2           Professor Snape
5           Arya Stark   8           true             3           3           Professor Moria


4. Display a narrower selection of columns (fewer columns than all of them, in other words) from both tables using one query.
sqlite> SELECT students.name, students.grade, teachers.name FROM students JOIN teachers ON students.teacher_id=teachers.id;
name         grade       name
-----------  ----------  ---------------
Amelia Pond  11          Professor Snape
Tom Bombadi  10          Professor McGon
Dead Pool    10          Professor Moria
Mal Reynold  12          Professor Snape
Arya Stark   8           Professor Moria
Jake Finn    9           Professor McGon


5. Delete an item that meets some condition (you can choose a condition that makes sense).
sqlite> DELETE FROM students WHERE name="Jake Finn";
sqlite>


6. Try a few different joins in your database:
sqlite> SELECT students.name FROM students LEFT JOIN teachers ON students.teacher_id=teachers.id;
name
-----------
Amelia Pond
Tom Bombadi
Dead Pool
Mal Reynold
Arya Stark

sqlite> SELECT teachers.name FROM teachers INNER JOIN students ON students.teacher_id=teachers.id;
name
---------------
Professor Snape
Professor McGon
Professor Moria
Professor Snape
Professor Moria

sqlite> SELECT students.name, students.permission_slip, teachers.name FROM teachers JOIN students ON students.teacher_id=teachers.id;
name         permission_slip  name
-----------  ---------------  ---------------
Amelia Pond  false            Professor Snape
Tom Bombadi  true             Professor McGon
Dead Pool    false            Professor Moria
Mal Reynold  true             Professor Snape
Arya Stark   true             Professor Moria

sqlite> SELECT * FROM students CROSS JOIN teachers ON students.teacher_id=teachers.id;
id          name         grade       permission_slip  teacher_id  id          name
----------  -----------  ----------  ---------------  ----------  ----------  ---------------
1           Amelia Pond  11          false            2           2           Professor Snape
2           Tom Bombadi  10          true             1           1           Professor McGon
3           Dead Pool    10          false            3           3           Professor Moria
4           Mal Reynold  12          true             2           2           Professor Snape
5           Arya Stark   8           true             3           3           Professor Moria

